{
  "realtime_start": "2026-05-28",
  "realtime_end": "2026-05-28",
  "observation_start": "2026-05-28",
  "observation_end": "2026-05-28",
  "units": "Percent",
  "output_type": 1,
  "file_type": "example",
  "order_by": "example",
  "sort_order": "example",
  "count": 1,
  "offset": 0,
  "limit": 1000,
  "observations": [
    null,
    null
  ]
}